{
  "schemaVersion": 1,
  "itemId": "comment-thread",
  "riskClass": 3,
  "serverBoundary": "client-island",
  "directions": ["ltr", "rtl"],
  "locales": ["en-US", "de-DE", "ar-EG", "he-IL", "ja-JP", "hi-IN", "en-XA", "ar-XB"],
  "inputModalities": ["keyboard", "mouse", "touch", "screen-reader", "speech", "switch"],
  "themes": ["light", "dark", "enhanced-contrast", "forced-colors"],
  "densities": ["comfortable", "compact", "touch"],
  "stateGroups": [
    "empty",
    "populated",
    "open",
    "resolved",
    "draft",
    "optimistic",
    "error",
    "mentions",
    "long-content",
    "narrow",
    "rtl",
    "forced-colors"
  ],
  "slots": [
    {
      "name": "comment-thread",
      "semanticElement": "named region",
      "refTarget": "HTMLDivElement",
      "states": ["open", "resolved", "empty", "populated"]
    },
    {
      "name": "comment-thread-comments",
      "semanticElement": "ordered list of articles",
      "refTarget": "none",
      "states": ["optimistic", "error"]
    },
    {
      "name": "comment-thread-reply",
      "semanticElement": "native form",
      "refTarget": "none",
      "states": ["draft"]
    }
  ],
  "contract": { "id": "comment-thread-accessibility", "version": "0.1.0" },
  "passport": { "id": "comment-thread-quality-passport", "version": "0.0.0" }
}
