{
  "schemaVersion": 1,
  "itemId": "reasoning",
  "riskClass": 2,
  "serverBoundary": "client-island",
  "directions": ["ltr", "rtl"],
  "locales": ["en-US", "de-DE", "ar-EG", "he-IL", "ja-JP", "hi-IN", "en-XA", "ar-XB"],
  "inputModalities": ["keyboard", "mouse", "touch", "screen-reader", "speech", "switch"],
  "themes": ["light", "dark", "enhanced-contrast", "forced-colors"],
  "densities": ["comfortable", "compact", "touch"],
  "stateGroups": [
    "closed",
    "open",
    "idle",
    "streaming",
    "complete",
    "error",
    "progress",
    "reduced-motion",
    "rtl",
    "forced-colors"
  ],
  "slots": [
    {
      "name": "reasoning",
      "semanticElement": "details",
      "refTarget": "HTMLDetailsElement",
      "states": ["closed", "open", "streaming", "complete", "error"]
    },
    {
      "name": "reasoning-summary",
      "semanticElement": "summary",
      "refTarget": "internal",
      "states": ["focus-visible"]
    }
  ],
  "contract": { "id": "reasoning-accessibility", "version": "0.1.0" },
  "passport": { "id": "reasoning-quality-passport", "version": "0.0.0" }
}
