{
  "schemaVersion": 1,
  "itemId": "radio-group",
  "riskClass": 2,
  "serverBoundary": "client-island",
  "directions": ["ltr", "rtl"],
  "locales": ["en-US", "de-DE", "ar-EG", "he-IL", "ja-JP", "hi-IN", "en-XA", "ar-XB"],
  "inputModalities": ["keyboard", "mouse", "touch", "screen-reader", "speech", "switch"],
  "themes": ["light", "dark", "enhanced-contrast", "forced-colors"],
  "densities": ["comfortable", "compact", "touch"],
  "stateGroups": [
    "default",
    "checked",
    "empty",
    "required",
    "invalid",
    "disabled",
    "keyboard",
    "card",
    "reset",
    "rtl"
  ],
  "slots": [
    {
      "name": "radio-group",
      "semanticElement": "fieldset",
      "refTarget": "HTMLFieldSetElement",
      "states": ["disabled", "invalid", "layout"]
    },
    {
      "name": "radio-group-label",
      "semanticElement": "legend",
      "refTarget": "none",
      "states": ["visible"]
    },
    {
      "name": "radio-group-item",
      "semanticElement": "div",
      "refTarget": "none",
      "states": ["checked", "unchecked", "disabled", "card"]
    },
    {
      "name": "radio-group-item-label-root",
      "semanticElement": "label",
      "refTarget": "none",
      "states": ["checked", "unchecked"]
    },
    {
      "name": "radio-group-input",
      "semanticElement": "input type radio",
      "refTarget": "HTMLInputElement",
      "states": ["checked", "required", "disabled"]
    },
    {
      "name": "radio-group-indicator",
      "semanticElement": "span aria-hidden",
      "refTarget": "none",
      "states": ["checked", "unchecked"]
    }
  ],
  "contract": { "id": "radio-group-accessibility", "version": "0.1.0" },
  "passport": { "id": "radio-group-quality-passport", "version": "0.0.0" }
}
