{
  "schemaVersion": 1,
  "itemId": "scheduler-kit",
  "riskClass": 3,
  "serverBoundary": "client-island",
  "directions": ["ltr", "rtl"],
  "locales": ["en-US", "de-DE", "ar-EG", "he-IL", "ja-JP", "hi-IN", "en-XA", "ar-XB"],
  "inputModalities": ["keyboard", "mouse", "touch", "screen-reader", "speech", "switch"],
  "themes": ["light", "dark", "enhanced-contrast", "forced-colors"],
  "densities": ["comfortable", "compact", "touch"],
  "stateGroups": [
    "loading",
    "empty",
    "ready",
    "disabled",
    "read-only",
    "offline",
    "error",
    "validation",
    "conflict",
    "calendar",
    "agenda",
    "narrow",
    "rtl",
    "forced-colors",
    "reduced-motion",
    "temporal-boundaries"
  ],
  "slots": [
    {
      "name": "scheduler-kit",
      "semanticElement": "div containing schedule landmarks",
      "refTarget": "HTMLDivElement",
      "states": ["loading", "ready", "offline", "error"]
    },
    {
      "name": "scheduler-agenda",
      "semanticElement": "section with ordered events",
      "refTarget": "none",
      "states": ["empty", "populated"]
    },
    {
      "name": "scheduler-editor",
      "semanticElement": "section containing native form",
      "refTarget": "none",
      "states": ["create", "edit", "invalid", "pending"]
    }
  ],
  "contract": { "id": "scheduler-kit-accessibility", "version": "0.1.0" },
  "passport": { "id": "scheduler-kit-quality-passport", "version": "0.0.0" }
}
