{
  "schemaVersion": 1,
  "itemId": "button-group",
  "riskClass": 1,
  "serverBoundary": "client-island",
  "directions": ["ltr", "rtl"],
  "locales": ["en-US", "de-DE", "ar-EG", "he-IL", "ja-JP", "hi-IN", "en-XA", "ar-XB"],
  "inputModalities": ["keyboard", "mouse", "touch", "screen-reader", "speech", "switch"],
  "themes": ["light", "dark", "enhanced-contrast", "forced-colors"],
  "densities": ["comfortable", "compact", "touch"],
  "stateGroups": ["default", "hover", "active", "focus-visible", "disabled", "populated"],
  "slots": [
    {
      "name": "button-group",
      "semanticElement": "div role=group or toolbar",
      "refTarget": "HTMLDivElement",
      "states": []
    }
  ],
  "contract": {
    "id": "button-group-accessibility",
    "version": "0.1.0"
  },
  "passport": {
    "id": "button-group-quality-passport",
    "version": "0.0.0"
  }
}
