{
  "schemaVersion": 1,
  "itemId": "aspect-ratio",
  "riskClass": 1,
  "serverBoundary": "server-compatible",
  "directions": ["ltr", "rtl"],
  "locales": ["en-US", "de-DE", "ar-EG", "he-IL", "ja-JP", "hi-IN", "en-XA", "ar-XB"],
  "inputModalities": ["keyboard", "mouse", "touch", "screen-reader", "speech", "switch"],
  "themes": ["light", "dark", "enhanced-contrast", "forced-colors"],
  "densities": ["comfortable", "compact", "touch"],
  "stateGroups": [
    "square",
    "video",
    "portrait",
    "wide",
    "custom",
    "fit-contain",
    "fit-cover",
    "fallback",
    "long-content",
    "narrow",
    "rtl"
  ],
  "slots": [
    {
      "name": "aspect-ratio",
      "semanticElement": "div",
      "refTarget": "HTMLDivElement",
      "states": ["ratio", "custom-ratio", "fit", "fallback"]
    }
  ],
  "contract": { "id": "aspect-ratio-accessibility", "version": "0.1.0" },
  "passport": { "id": "aspect-ratio-quality-passport", "version": "0.0.0" }
}
