{
  "schemaVersion": 1,
  "itemId": "date-picker",
  "riskClass": 3,
  "serverBoundary": "client-island",
  "directions": ["ltr", "rtl"],
  "locales": ["en-US", "de-DE", "ar-EG", "he-IL", "ja-JP", "hi-IN", "en-XA", "ar-XB"],
  "inputModalities": ["keyboard", "mouse", "touch", "screen-reader", "speech", "switch"],
  "themes": ["light", "dark", "enhanced-contrast", "forced-colors"],
  "densities": ["comfortable", "compact", "touch"],
  "stateGroups": [
    "default",
    "focus-visible",
    "disabled",
    "read-only",
    "invalid",
    "required",
    "empty",
    "populated",
    "rtl"
  ],
  "slots": [
    {
      "name": "date-picker",
      "semanticElement": "div",
      "refTarget": "HTMLDivElement",
      "states": ["disabled", "read-only", "invalid", "required", "empty", "populated"]
    },
    {
      "name": "date-field",
      "semanticElement": "Mergora DateField",
      "refTarget": "none",
      "states": ["default", "disabled"]
    },
    {
      "name": "date-picker-presets",
      "semanticElement": "optional button group",
      "refTarget": "none",
      "states": ["default", "disabled"]
    }
  ],
  "contract": {
    "id": "date-picker-accessibility",
    "version": "0.1.0"
  },
  "passport": {
    "id": "date-picker-quality-passport",
    "version": "0.0.0"
  }
}
