{
  "schemaVersion": 1,
  "itemId": "icon-button",
  "riskClass": 1,
  "serverBoundary": "server-compatible",
  "directions": ["ltr", "rtl"],
  "locales": ["en-US", "de-DE", "ar-EG", "he-IL", "ja-JP", "hi-IN", "en-XA", "ar-XB"],
  "inputModalities": ["keyboard", "mouse", "touch", "screen-reader", "speech", "switch"],
  "themes": ["light", "dark", "enhanced-contrast", "forced-colors"],
  "densities": ["comfortable", "compact", "touch"],
  "stateGroups": [
    "default",
    "hover",
    "active",
    "focus-visible",
    "disabled",
    "loading",
    "populated",
    "destructive"
  ],
  "slots": [
    {
      "name": "icon-button",
      "semanticElement": "button",
      "refTarget": "HTMLButtonElement",
      "states": []
    },
    {
      "name": "icon-button-icon",
      "semanticElement": "span",
      "refTarget": "none",
      "states": []
    },
    {
      "name": "icon-button-pending-indicator",
      "semanticElement": "span",
      "refTarget": "none",
      "states": []
    }
  ],
  "contract": {
    "id": "icon-button-accessibility",
    "version": "0.1.0"
  },
  "passport": {
    "id": "icon-button-quality-passport",
    "version": "0.0.0"
  }
}
