{
  "schemaVersion": 1,
  "itemId": "carousel",
  "riskClass": 3,
  "serverBoundary": "client-island",
  "directions": ["ltr", "rtl"],
  "locales": ["en-US", "de-DE", "ar-EG", "he-IL", "ja-JP", "hi-IN", "en-XA", "ar-XB"],
  "inputModalities": ["keyboard", "mouse", "touch", "screen-reader", "speech", "switch"],
  "themes": ["light", "dark", "enhanced-contrast", "forced-colors"],
  "densities": ["comfortable", "compact", "touch"],
  "stateGroups": [
    "default",
    "enhancement-disabled",
    "enhancement-enabled",
    "empty",
    "narrow",
    "rtl",
    "forced-colors",
    "reduced-motion"
  ],
  "slots": [
    {
      "name": "carousel",
      "semanticElement": "See accessibility contract.",
      "refTarget": "See API contract.",
      "states": ["enhancement-disabled", "enhancement-enabled"]
    }
  ],
  "contract": {
    "id": "carousel-accessibility",
    "version": "0.1.0"
  },
  "passport": {
    "id": "carousel-quality-passport",
    "version": "0.0.0"
  }
}
