{
  "schemaVersion": 1,
  "itemId": "settings-workspace",
  "riskClass": 3,
  "serverBoundary": "client-island",
  "directions": ["ltr", "rtl"],
  "locales": ["en-US", "de-DE", "ar-EG", "he-IL", "ja-JP", "hi-IN", "en-XA", "ar-XB"],
  "inputModalities": ["keyboard", "mouse", "touch", "screen-reader", "speech", "switch"],
  "themes": ["light", "dark", "enhanced-contrast", "forced-colors"],
  "densities": ["comfortable", "compact", "touch"],
  "stateGroups": [
    "profile",
    "preferences",
    "notifications",
    "security",
    "controlled",
    "uncontrolled",
    "clean",
    "dirty",
    "loading",
    "saved",
    "error",
    "disabled",
    "read-only",
    "destructive",
    "reset",
    "narrow",
    "rtl",
    "forced-colors",
    "reduced-motion"
  ],
  "slots": [
    {
      "name": "settings-workspace",
      "semanticElement": "native form",
      "refTarget": "HTMLFormElement",
      "states": ["controlled", "uncontrolled", "clean", "dirty", "loading", "saved", "error"]
    },
    {
      "name": "settings-navigation",
      "semanticElement": "nav",
      "refTarget": "none",
      "states": ["profile", "preferences", "notifications", "security"]
    },
    {
      "name": "settings-unsaved-prompt",
      "semanticElement": "optional alertdialog",
      "refTarget": "HTMLDivElement",
      "states": ["dirty"]
    },
    {
      "name": "settings-destructive-review",
      "semanticElement": "optional confirmation region",
      "refTarget": "none",
      "states": ["destructive"]
    }
  ],
  "contract": { "id": "settings-workspace-accessibility", "version": "0.1.0" },
  "passport": { "id": "settings-workspace-quality-passport", "version": "0.0.0" }
}
