{
  "schemaVersion": 1,
  "itemId": "presence",
  "riskClass": 2,
  "serverBoundary": "client-island",
  "directions": ["ltr", "rtl"],
  "locales": ["en-US", "de-DE", "ar-EG", "he-IL", "ja-JP", "hi-IN", "en-XA", "ar-XB"],
  "inputModalities": ["keyboard", "mouse", "touch", "screen-reader", "speech", "switch"],
  "themes": ["light", "dark", "enhanced-contrast", "forced-colors"],
  "densities": ["comfortable", "compact", "touch"],
  "stateGroups": [
    "base",
    "responsive-reflow",
    "locale-direction",
    "user-preferences",
    "long-content",
    "interaction",
    "async"
  ],
  "slots": [
    {
      "name": "presence",
      "semanticElement": "consumer element",
      "refTarget": "HTMLElement",
      "states": ["entering", "entered", "exiting"]
    }
  ],
  "contract": { "id": "presence-accessibility", "version": "0.1.0" },
  "passport": { "id": "presence-quality-passport", "version": "0.0.0" }
}
